<?xml version="1.0" encoding="UTF-8"?>
<!ELEMENT books (book*)>
<!ELEMENT book ((bookname|title),price,author+,publication?)>
<!ELEMENT bookname (#PCDATA)>
<!ELEMENT title (#PCDATA)>
<!ELEMENT price (#PCDATA)>
<!ELEMENT author (#PCDATA)>
<!ELEMENT publication (#PCDATA)>